[
  {
    "id": "osaka:evidence:ishiyama",
    "locator": "石山（大坂）本願寺の1533年開山、濠・土居に囲まれた寺内町、1580年退去の説明",
    "note": "Citation-only metadata; no authored source content is reproduced.",
    "sourceId": "osaka:source:ishiyama-site",
    "supports": [
      "temporal",
      "location",
      "identity"
    ],
    "usage": "citation"
  },
  {
    "id": "osaka:evidence:ishiyama-shape",
    "locator": "石山本願寺代表点・寺内町Polygonの作成方法と限界",
    "note": "公式ページの現在地住所と上町台地の説明を、代表点と低頂点Polygonへ置き換えました。寺域、濠、土居、町割の精密な範囲ではありません。",
    "publicationBasis": "original-reconstruction",
    "sourceId": "osaka:source:shape-notes",
    "supports": [
      "geometry",
      "location"
    ],
    "usage": "derived-geometry"
  },
  {
    "id": "osaka:evidence:kawachi-bay",
    "locator": "大阪湾・河内湾・河内湖の形成と古代の海岸線に関する歴史説明",
    "note": "Citation-only metadata; no authored source content is reproduced.",
    "sourceId": "osaka:source:bay-vision",
    "supports": [
      "temporal",
      "location",
      "identity"
    ],
    "usage": "citation"
  },
  {
    "id": "osaka:evidence:kawachi-bay-shape",
    "locator": "河内湾・河内湖Polygonの作成方法と限界",
    "note": "大阪府の地形説明と上町台地・東部大阪の相対関係を、少数頂点の概略面へ置き換えました。古代の正確な海岸線・水深・水面ではありません。",
    "publicationBasis": "original-reconstruction",
    "sourceId": "osaka:source:shape-notes",
    "supports": [
      "geometry",
      "location"
    ],
    "usage": "derived-geometry"
  },
  {
    "id": "osaka:evidence:watanabe",
    "locator": "天満橋から北浜南岸にあった渡辺津と、熊野詣・水運の説明",
    "note": "Citation-only metadata; no authored source content is reproduced.",
    "sourceId": "osaka:source:city-history",
    "supports": [
      "temporal",
      "location",
      "identity"
    ],
    "usage": "citation"
  },
  {
    "id": "osaka:evidence:watanabe-shape",
    "locator": "渡辺津代表Pointの作成方法と限界",
    "note": "天満橋・北浜南岸という説明の相対位置を代表Pointへ置き換えました。港域、岸線、船着場、航路の精密な位置ではありません。",
    "publicationBasis": "original-reconstruction",
    "sourceId": "osaka:source:shape-notes",
    "supports": [
      "geometry",
      "location"
    ],
    "usage": "derived-geometry"
  },
  {
    "id": "osaka:evidence:yodo",
    "locator": "淀川・大和川による水運と、京都へつながる交通の要所という説明",
    "note": "Citation-only metadata; no authored source content is reproduced.",
    "sourceId": "osaka:source:city-history",
    "supports": [
      "temporal",
      "location",
      "identity"
    ],
    "usage": "citation"
  },
  {
    "id": "osaka:evidence:yodo-shape",
    "locator": "淀川水運概略LineStringの作成方法と限界",
    "note": "大阪市の交通説明を上町台地北端と淀川の相対関係に置き換えた概略線です。歴史的な河道中心線・航路ではありません。",
    "publicationBasis": "original-reconstruction",
    "sourceId": "osaka:source:shape-notes",
    "supports": [
      "geometry",
      "location"
    ],
    "usage": "derived-geometry"
  }
]
