[
  {
    "id": "ogurike:evidence:monument-citation",
    "locator": "『所在地』『位置座標』『建立年』欄",
    "note": "Citation-only metadata; no authored source content is reproduced.",
    "sourceId": "ogurike:source:kyoto-city-monument",
    "supports": [
      "temporal",
      "location",
      "identity"
    ],
    "usage": "citation"
  },
  {
    "id": "ogurike:evidence:monument-geometry",
    "locator": "『作成方法』の1942年Pointに関する記録",
    "note": "所在地をもとに小数第3位へ丸めた代表点をChronomapが作成した。原座標や画像を転載していない。",
    "publicationBasis": "original-reconstruction",
    "sourceId": "ogurike:source:shape-notes",
    "supports": [
      "geometry",
      "location"
    ],
    "usage": "derived-geometry"
  },
  {
    "id": "ogurike:evidence:ujigawa-1590-geometry",
    "locator": "PDF p.2-22 図2.2-1①『秀吉による河川工事前（1590年）』",
    "note": "図の相対的な流路関係を少数の折れ点へ手動加工した概略線であり、正確な河道中心線ではない。",
    "publicationBasis": "open-license",
    "sourceId": "ogurike:source:mlit-ogurike-transition",
    "supports": [
      "geometry"
    ],
    "usage": "derived-geometry"
  },
  {
    "id": "ogurike:evidence:ujigawa-1590-temporal",
    "locator": "PDF p.2-21末尾–p.2-22 図2.2-1①",
    "note": "資料図が河川工事前の1590年スナップショットとして示すことを確認する。",
    "sourceId": "ogurike:source:mlit-ogurike-transition",
    "supports": [
      "temporal",
      "location",
      "identity"
    ],
    "usage": "citation"
  },
  {
    "id": "ogurike:evidence:ujigawa-1596-geometry",
    "locator": "PDF p.2-22 図2.2-1②『秀吉による河川工事後（1596年）』",
    "note": "図②が示す、主湖面から分離して北側を通る流路関係を少数の折れ点へ手動加工した概略線である。精密な河道中心線、堤防線形、接続位置は示さない。",
    "publicationBasis": "open-license",
    "sourceId": "ogurike:source:mlit-ogurike-transition",
    "supports": [
      "geometry",
      "location"
    ],
    "usage": "derived-geometry"
  },
  {
    "id": "ogurike:evidence:ujigawa-1596-temporal",
    "locator": "PDF p.2-21末尾–p.2-22 図2.2-1②",
    "note": "資料図が河川工事後の1596年スナップショットとして示すことを確認する。",
    "sourceId": "ogurike:source:mlit-ogurike-transition",
    "supports": [
      "temporal",
      "location",
      "identity"
    ],
    "usage": "citation"
  },
  {
    "id": "ogurike:evidence:waterbody-1590-geometry",
    "locator": "PDF p.2-22 図2.2-1①『秀吉による河川工事前（1590年）』",
    "note": "変遷図①に示される巨椋池周辺の相対的な水域範囲と湾入を、現在の地図上へ手動加工した概略面である。原図の境界・面積・水深を再現しない。",
    "publicationBasis": "open-license",
    "sourceId": "ogurike:source:mlit-ogurike-transition",
    "supports": [
      "geometry",
      "location"
    ],
    "usage": "derived-geometry"
  },
  {
    "id": "ogurike:evidence:waterbody-1590-temporal",
    "locator": "PDF p.2-21末尾–p.2-22 図2.2-1①",
    "note": "資料図が河川工事前の1590年スナップショットとして示すことを確認する。",
    "sourceId": "ogurike:source:mlit-ogurike-transition",
    "supports": [
      "temporal",
      "identity"
    ],
    "usage": "citation"
  },
  {
    "id": "ogurike:evidence:waterbody-1596-geometry",
    "locator": "PDF p.2-22 図2.2-1②『秀吉による河川工事後（1596年）』",
    "note": "変遷図②に示される巨椋池周辺の相対的な水域範囲と湾入を、現在の地図上へ手動加工した概略面である。工事後の正確な湖岸線ではない。",
    "publicationBasis": "open-license",
    "sourceId": "ogurike:source:mlit-ogurike-transition",
    "supports": [
      "geometry",
      "location"
    ],
    "usage": "derived-geometry"
  },
  {
    "id": "ogurike:evidence:waterbody-1596-temporal",
    "locator": "PDF p.2-22 図2.2-1②",
    "note": "資料図が河川工事後の1596年スナップショットとして示すことを確認する。",
    "sourceId": "ogurike:source:mlit-ogurike-transition",
    "supports": [
      "temporal",
      "identity"
    ],
    "usage": "citation"
  },
  {
    "id": "ogurike:evidence:waterbody-1885-geometry",
    "locator": "PDF p.2-22 図2.2-1③『淀川改良工事前（1885年）』",
    "note": "図③の主水域に見える西側と東～南東側の二葉状の輪郭、細い中央接続、南側の湾入を手動加工した概略形状である。正確な岸線・面積・深度・周辺水域全体を示さず、島状表示や北東の離れた水面も含まない。",
    "publicationBasis": "open-license",
    "sourceId": "ogurike:source:mlit-ogurike-transition",
    "supports": [
      "geometry",
      "location"
    ],
    "usage": "derived-geometry"
  },
  {
    "id": "ogurike:evidence:waterbody-1885-temporal",
    "locator": "PDF p.2-22 図2.2-1③",
    "note": "資料図が淀川改良工事前の1885年スナップショットとして示すことを確認する。",
    "sourceId": "ogurike:source:mlit-ogurike-transition",
    "supports": [
      "temporal",
      "identity"
    ],
    "usage": "citation"
  },
  {
    "id": "ogurike:evidence:waterbody-1933-geometry",
    "locator": "PDF p.2-22 図2.2-1⑤『淀川改良工事増補完成時（1933年）』",
    "note": "図⑤は図④と同程度の主水域を描く。湖岸の差を座標化できる資料精度がないため1910年の概略輪郭を再利用し、完全に同一の湖岸とは主張しない。別河道や周辺池、面積逆算は含めない。",
    "publicationBasis": "open-license",
    "sourceId": "ogurike:source:mlit-ogurike-transition",
    "supports": [
      "geometry",
      "location"
    ],
    "usage": "derived-geometry"
  },
  {
    "id": "ogurike:evidence:waterbody-1933-temporal",
    "locator": "PDF p.2-22 図2.2-1⑤",
    "note": "資料図が淀川改良工事増補完成時の1933年スナップショットとして示すことを確認する。",
    "sourceId": "ogurike:source:mlit-ogurike-transition",
    "supports": [
      "temporal",
      "identity"
    ],
    "usage": "citation"
  },
  {
    "id": "ogurike:evidence:waterbody-geometry",
    "locator": "PDF p.2-22 図2.2-1④『淀川改良工事完成時（1910年）』",
    "note": "図2.2-1④から、北西側の入り込み、東側の張り出し、南岸の複数の凹凸を読める範囲で手動再構成した概略面である。縮尺・投影を測量成果として扱わず、精密な境界、別河道、周辺池、面積逆算を示さない。",
    "publicationBasis": "open-license",
    "sourceId": "ogurike:source:mlit-ogurike-transition",
    "supports": [
      "geometry"
    ],
    "usage": "derived-geometry"
  },
  {
    "id": "ogurike:evidence:waterbody-region",
    "locator": "『概要』および『5万分の1 京都東南部・京都西南部（大正6年発行）』",
    "note": "Citation-only metadata; no authored source content is reproduced.",
    "sourceId": "ogurike:source:kyoto-prefecture-rdb",
    "supports": [
      "location",
      "identity",
      "temporal"
    ],
    "usage": "citation"
  },
  {
    "id": "ogurike:evidence:waterbody-temporal",
    "locator": "PDF p.2-22 図2.2-1④",
    "note": "資料図が淀川改良工事完成時の1910年スナップショットとして示すことを確認する。",
    "sourceId": "ogurike:source:mlit-ogurike-transition",
    "supports": [
      "temporal",
      "identity"
    ],
    "usage": "citation"
  }
]
