[
  {
    "id": "kinugawa:evidence:change-map",
    "locator": "旧版地形図と米軍写真による河道変遷の説明",
    "note": "Citation-only metadata; no authored source content is reproduced.",
    "sourceId": "kinugawa:source:river-change",
    "supports": [
      "temporal",
      "location",
      "identity"
    ],
    "usage": "citation"
  },
  {
    "id": "kinugawa:evidence:current-geometry",
    "locator": "2020年LineString",
    "note": "公式河川概要の相対位置を少数の折れ点へ置いた概略線で、精密な河道中心線ではない。",
    "publicationBasis": "original-reconstruction",
    "sourceId": "kinugawa:source:shape-notes",
    "supports": [
      "geometry",
      "location"
    ],
    "usage": "derived-geometry"
  },
  {
    "id": "kinugawa:evidence:current-temporal",
    "locator": "現行河川概要を2020年比較時点として扱う記録",
    "note": "Citation-only metadata; no authored source content is reproduced.",
    "sourceId": "kinugawa:source:mlit-overview",
    "supports": [
      "temporal",
      "identity"
    ],
    "usage": "citation"
  },
  {
    "id": "kinugawa:evidence:history",
    "locator": "鬼怒川・小貝川の河道分離と江戸時代初期の治水史",
    "note": "Citation-only metadata; no authored source content is reproduced.",
    "sourceId": "kinugawa:source:history",
    "supports": [
      "temporal",
      "location",
      "identity"
    ],
    "usage": "citation"
  },
  {
    "id": "kinugawa:evidence:old-geometry",
    "locator": "768年・1629年LineString",
    "note": "資料が示す接続関係を少数の折れ点で表した概略線。旧河道の精密な位置・幅・全区間を復元しない。",
    "publicationBasis": "original-reconstruction",
    "sourceId": "kinugawa:source:shape-notes",
    "supports": [
      "geometry",
      "location"
    ],
    "usage": "derived-geometry"
  },
  {
    "id": "kinugawa:evidence:overview",
    "locator": "鬼怒川の水源・流路・利根川への合流に関する河川概要",
    "note": "Citation-only metadata; no authored source content is reproduced.",
    "sourceId": "kinugawa:source:mlit-overview",
    "supports": [
      "location",
      "identity"
    ],
    "usage": "citation"
  },
  {
    "id": "kinugawa:evidence:separation-geometry",
    "locator": "1629年Point",
    "note": "分離事業の比較用代表点で、工事区間・施設・旧河道の正確な位置ではない。",
    "publicationBasis": "original-reconstruction",
    "sourceId": "kinugawa:source:shape-notes",
    "supports": [
      "geometry",
      "location"
    ],
    "usage": "derived-geometry"
  }
]
