[
  {
    "id": "azuchijo:evidence:timeline",
    "sourceId": "azuchijo:source:shiga-castle",
    "locator": "安土城の築城開始（1576年）と焼失・廃城の経緯",
    "usage": "citation",
    "supports": ["temporal", "identity"],
    "note": "1576年に築城が始まり、1582年の本能寺の変後に主郭部が焼失したという引用メタデータ。本文は再現しない。"
  },
  {
    "id": "azuchijo:evidence:location",
    "sourceId": "azuchijo:source:omi8-castle",
    "locator": "安土山・琵琶湖東岸にある安土城跡の所在地と概要",
    "usage": "citation",
    "supports": ["location", "identity"],
    "note": "安土城が安土山にあり、琵琶湖東岸の安土付近に位置するという引用メタデータ。本文・写真は再現しない。"
  },
  {
    "id": "azuchijo:evidence:shape",
    "sourceId": "azuchijo:source:shape-notes",
    "locator": "代表点・東岸概略線の作成方法と限界",
    "usage": "derived-geometry",
    "supports": ["geometry", "location"],
    "note": "公開された所在地の相対関係を少数の頂点へ置き換えたChronomap独自の概略復元。現在・過去の正確な境界や湖岸線ではない。",
    "publicationBasis": "original-reconstruction"
  },
  {
    "id": "azuchijo:evidence:transport",
    "sourceId": "azuchijo:source:shiga-biwako-human",
    "locator": "安土城などの湖岸拠点と、琵琶湖を利用する人の移動・物資輸送を行う湖上交通の概要",
    "usage": "citation",
    "supports": ["temporal", "location", "identity"],
    "note": "安土桃山期の湖上交通と安土城の位置関係を示す引用メタデータ。個別の航路、港、船着場、運航日を特定する資料ではありません。"
  },
  {
    "id": "azuchijo:evidence:omi-control",
    "sourceId": "azuchijo:source:omi-control",
    "locator": "近江支配と琵琶湖岸の拠点城郭に関する解説",
    "usage": "citation",
    "supports": ["temporal", "location", "identity"],
    "note": "信長の上洛後の近江支配、1576年の安土城築城、琵琶湖岸の拠点城郭網が近江全体の支配を目的としたという引用メタデータ。行政境界や精密な実効支配範囲を示す資料ではありません。"
  },
  {
    "id": "azuchijo:evidence:omi-shape",
    "sourceId": "azuchijo:source:shape-notes",
    "locator": "近江支配の拠点網 Polygon の作成方法と限界",
    "usage": "derived-geometry",
    "supports": ["geometry", "location"],
    "note": "滋賀県の拠点城郭・近江全体という説明を、琵琶湖岸の拠点網を囲む少数の頂点へ置き換えたChronomap独自の概略復元。行政境界・国境・実効支配の精密な面ではありません。",
    "publicationBasis": "original-reconstruction"
  },
  {
    "id": "azuchijo:evidence:omi-polity",
    "sourceId": "azuchijo:source:omi-control",
    "locator": "信長による近江支配と安土城・拠点城郭に関する解説",
    "usage": "citation",
    "supports": ["temporal", "location", "identity"],
    "note": "滋賀県資料が説明する信長による近江支配、1576年の安土城、近江全体の支配を目的とした拠点城郭。政治中枢の正確な範囲や行政境界を示す資料ではありません。"
  },
  {
    "id": "azuchijo:evidence:omi-polity-shape",
    "sourceId": "azuchijo:source:omi-polity-shape",
    "locator": "政治中枢Polygonの作成方法と限界",
    "usage": "derived-geometry",
    "supports": ["geometry", "location"],
    "note": "安土城を中心とする政治中枢という解釈を、少数頂点の2案Polygonへ置き換えたChronomap独自の概略復元。近江全域の行政境界・国境・実効支配面ではありません。",
    "publicationBasis": "original-reconstruction"
  },
  {
    "id": "azuchijo:evidence:omi-port",
    "sourceId": "azuchijo:source:jyorakuji-port",
    "locator": "常楽寺湊の城下町・物資輸送・交易・軍事上の位置づけ",
    "usage": "citation",
    "supports": ["temporal", "location", "identity"],
    "note": "滋賀県資料が説明する、安土城築城に伴う常楽寺湊の物資輸送・交易・軍事の拠点性と、琵琶湖水運との結節関係。港域や船着場の正確な座標を示す資料ではありません。"
  },
  {
    "id": "azuchijo:evidence:omi-port-shape",
    "sourceId": "azuchijo:source:jyorakuji-port-shape",
    "locator": "常楽寺湊代表Pointの作成方法と限界",
    "usage": "derived-geometry",
    "supports": ["geometry", "location"],
    "note": "安土城・城下町・西の湖／常楽寺湊の相対関係を、港の代表Pointへ置き換えたChronomap独自の概略復元。港域、岸線、船着場、航路の精密な位置ではありません。",
    "publicationBasis": "original-reconstruction"
  },
  {
    "id": "azuchijo:evidence:omi-settlement",
    "sourceId": "azuchijo:source:jyorakuji-port",
    "locator": "安土城築城に伴う城下町跡（推定）の範囲と周辺集落の説明",
    "usage": "citation",
    "supports": ["temporal", "location", "identity"],
    "note": "滋賀県資料が説明する安土城下町跡（推定）の範囲と、安土山西麓・常楽寺・下豊浦の関係。城下町の街区や集落境界の精密な面を示す資料ではありません。"
  },
  {
    "id": "azuchijo:evidence:omi-settlement-shape",
    "sourceId": "azuchijo:source:azuchi-settlement-shape",
    "locator": "安土城下町推定Polygonの作成方法と限界",
    "usage": "derived-geometry",
    "supports": ["geometry", "location"],
    "note": "安土山・城下町・常楽寺湊の相対関係と公開資料の推定範囲を、少数頂点のPolygonへ置き換えたChronomap独自の概略復元。行政境界、町割、屋敷地、道路、遺構の精密な範囲ではありません。",
    "publicationBasis": "original-reconstruction"
  }
]
