[
  {
    "id": "azuchijo:evidence:location",
    "locator": "安土山・琵琶湖東岸にある安土城跡の所在地と概要",
    "note": "Citation-only metadata; no authored source content is reproduced.",
    "sourceId": "azuchijo:source:omi8-castle",
    "supports": [
      "location",
      "identity"
    ],
    "usage": "citation"
  },
  {
    "id": "azuchijo:evidence:omi-control",
    "locator": "近江支配と琵琶湖岸の拠点城郭に関する解説",
    "note": "Citation-only metadata; no authored source content is reproduced.",
    "sourceId": "azuchijo:source:omi-control",
    "supports": [
      "temporal",
      "location",
      "identity"
    ],
    "usage": "citation"
  },
  {
    "id": "azuchijo:evidence:omi-shape",
    "locator": "近江支配の拠点網 Polygon の作成方法と限界",
    "note": "滋賀県の拠点城郭・近江全体という説明を、琵琶湖岸の拠点網を囲む少数の頂点へ置き換えたChronomap独自の概略復元。行政境界・国境・実効支配の精密な面ではありません。",
    "publicationBasis": "original-reconstruction",
    "sourceId": "azuchijo:source:shape-notes",
    "supports": [
      "geometry",
      "location"
    ],
    "usage": "derived-geometry"
  },
  {
    "id": "azuchijo:evidence:shape",
    "locator": "代表点・東岸概略線の作成方法と限界",
    "note": "公開された所在地の相対関係を少数の頂点へ置き換えたChronomap独自の概略復元。現在・過去の正確な境界や湖岸線ではない。",
    "publicationBasis": "original-reconstruction",
    "sourceId": "azuchijo:source:shape-notes",
    "supports": [
      "geometry",
      "location"
    ],
    "usage": "derived-geometry"
  },
  {
    "id": "azuchijo:evidence:timeline",
    "locator": "安土城の築城開始（1576年）と焼失・廃城の経緯",
    "note": "Citation-only metadata; no authored source content is reproduced.",
    "sourceId": "azuchijo:source:shiga-castle",
    "supports": [
      "temporal",
      "identity"
    ],
    "usage": "citation"
  },
  {
    "id": "azuchijo:evidence:transport",
    "locator": "安土城などの湖岸拠点と、琵琶湖を利用する人の移動・物資輸送を行う湖上交通の概要",
    "note": "Citation-only metadata; no authored source content is reproduced.",
    "sourceId": "azuchijo:source:shiga-biwako-human",
    "supports": [
      "temporal",
      "location",
      "identity"
    ],
    "usage": "citation"
  }
]
