[
  {
    "id": "sekigahara:evidence:battlefield",
    "locator": "慶長5年（1600年）の関ケ原の戦いと、関ケ原古戦場の歴史説明",
    "note": "Citation-only metadata; no authored source content is reproduced.",
    "sourceId": "sekigahara:source:memorial-about",
    "supports": [
      "temporal",
      "location",
      "identity"
    ],
    "usage": "citation"
  },
  {
    "id": "sekigahara:evidence:battlefield-course",
    "locator": "石田三成コースに示される古戦場・史跡巡りの案内",
    "note": "Citation-only metadata; no authored source content is reproduced.",
    "sourceId": "sekigahara:source:ishida-course",
    "supports": [
      "location",
      "identity"
    ],
    "usage": "citation"
  },
  {
    "id": "sekigahara:evidence:battlefield-shape",
    "locator": "関ケ原古戦場代表Pointの作成方法と限界",
    "note": "関ケ原盆地の古戦場を読むための代表Pointへ置き換えました。戦場全体、布陣、陣跡、戦線、行軍路の精密な位置や範囲ではありません。",
    "publicationBasis": "original-reconstruction",
    "sourceId": "sekigahara:source:shape-notes",
    "supports": [
      "geometry",
      "location"
    ],
    "usage": "derived-geometry"
  },
  {
    "id": "sekigahara:evidence:route",
    "locator": "南北の山の隙間を通る街道と、中山道・関ケ原宿が東西交通をつないだという歴史説明",
    "note": "Citation-only metadata; no authored source content is reproduced.",
    "sourceId": "sekigahara:source:town-plan",
    "supports": [
      "temporal",
      "location",
      "identity"
    ],
    "usage": "citation"
  },
  {
    "id": "sekigahara:evidence:route-shape",
    "locator": "中山道・関ケ原越え概略LineStringの作成方法と限界",
    "note": "東西の交通軸と関ケ原の峠越えを少数頂点の概略線へ置き換えました。歴史的な街道中心線、道幅、宿駅間距離ではありません。",
    "publicationBasis": "original-reconstruction",
    "sourceId": "sekigahara:source:shape-notes",
    "supports": [
      "geometry",
      "location"
    ],
    "usage": "derived-geometry"
  },
  {
    "id": "sekigahara:evidence:settlement",
    "locator": "中山道の58番目の関ケ原宿と、今須宿が東西をつなぐ宿場だったという説明",
    "note": "Citation-only metadata; no authored source content is reproduced.",
    "sourceId": "sekigahara:source:town-plan",
    "supports": [
      "temporal",
      "location",
      "identity"
    ],
    "usage": "citation"
  },
  {
    "id": "sekigahara:evidence:settlement-shape",
    "locator": "関ケ原宿代表Pointの作成方法と限界",
    "note": "関ケ原駅周辺を宿場の相対位置を読む代表Pointへ置き換えました。街区、屋敷、道幅、町域境界の精密な位置ではありません。",
    "publicationBasis": "original-reconstruction",
    "sourceId": "sekigahara:source:shape-notes",
    "supports": [
      "geometry",
      "location"
    ],
    "usage": "derived-geometry"
  }
]
