[{"id":"katori-sea:evidence:chiba-museum-figure","locator":"「古代・中世の香取の海と水陸交通」の資料図。","note":"古代・中世の水域と水陸交通の比較に使った。図の画像・形は公開パッケージへ含めない。","sourceId":"katori-sea:source:chiba-museum-figure","supports":["geometry","location","identity"],"usage":"citation"},{"id":"katori-sea:evidence:choshi-outlet","locator":"形状メモの『銚子口』補正、1200年・1600年。","note":"銚子市川口町の住所検索点からDEM境界までに幅300mの短い回廊を加えた。","publicationBasis":"original-reconstruction","sourceId":"katori-sea:source:chronomap-notes","supports":["geometry","location"],"usage":"derived-geometry"},{"id":"katori-sea:evidence:dem-model","locator":"DEM5a z13→DEM10b z13→DEM10b z12。700年4m・1200年3m・1600年2m。入り江用局所DEMは印旛沼4m・手賀沼5m。取得タイルは.cache/raw/dem/katori-sea/に保存。","note":"RGB標高から外洋連結した閾値以下セルをポリゴン化し、外洋・銚子口・入り江・佐原水路補正後にも面積1ha未満の穴と断片を除去した。入り江成分は史料で範囲を確認した2地点だけを対象とする。","publicationBasis":"open-license","sourceId":"katori-sea:source:gsi-dem","supports":["geometry","location"],"usage":"derived-geometry"},{"id":"katori-sea:evidence:gsi-address-search","locator":"土浦市大岩田・行方市玉造甲・潮来市潮来・香取市佐原・一ノ分目新田・印西市師戸・我孫子市高野山・銚子市川口町・犬吠埼・鹿嶋市宮中・成田市花崎町・佐倉市海隣寺町・鉾田市鉾田・大竹・つくば市研究学園・霞ヶ浦・北浦の検索応答。","note":"住所検索応答を位置基準と外洋seed・外洋カットに使った。入り江・佐原水路のPM指定検査点は別の作業指定座標として区別した。","sourceId":"katori-sea:source:gsi-address-search","supports":["location"],"usage":"citation"},{"id":"katori-sea:evidence:inbanuma-inlet","locator":"形状メモの『印旛沼の入り江』補正。PM指定点(140.20,35.77)、DEM局所成分4m以下、全3年代。","note":"香取市Vol.208は中世頃の香取海が印旛沼を含むと説明する。指定点を含む局所DEM低地成分を抽出し、個別の接続水路は資料で特定できないため主水域との回廊を作らず保持した。各代表年へ適用することは長期的な水域範囲を用いたモデル推定であり、各年の正確な湖岸を示さない。","publicationBasis":"original-reconstruction","sourceId":"katori-sea:source:chronomap-notes","supports":["geometry","location"],"usage":"derived-geometry"},{"id":"katori-sea:evidence:katori-city-vol148","locator":"Vol.148「香取の海と新島十六島 利根川が流れる前と後」、約1000年前の流域想定図。","note":"霞ヶ浦・印旛沼にまたがる広大な内海と銚子への流路変更を確認した。図はトレースしない。","sourceId":"katori-sea:source:katori-city-vol148","supports":["temporal","geometry","identity"],"usage":"citation"},{"id":"katori-sea:evidence:katori-city-vol208-map","locator":"Vol.208「香取の海と新田開発」、掲載模式図208-2。","note":"中世頃の内海が霞ヶ浦・印旛沼・手賀沼を含むという説明と、模式図を形状比較に使った。図はトレースしない。","sourceId":"katori-sea:source:katori-city-vol208","supports":["geometry","location","identity"],"usage":"citation"},{"id":"katori-sea:evidence:mlit-tone-eastward","locator":"利根川東遷 1594〜1654年、銚子から太平洋へ流下する説明。","note":"銚子口が太平洋側の流路終端であることと1600〜1654年の期間を確認した。","sourceId":"katori-sea:source:mlit-tone-eastward","supports":["temporal","geometry"],"usage":"citation"},{"id":"katori-sea:evidence:outer-ocean-cut","locator":"形状メモの『鹿島灘・銚子沖の外洋側』補正。","note":"鹿嶋市宮中・銚子市川口町・犬吠埼の住所検索応答をつないだ概略カットで、外洋側のNoData面を除いた。","publicationBasis":"original-reconstruction","sourceId":"katori-sea:source:chronomap-notes","supports":["geometry","location"],"usage":"derived-geometry"},{"id":"katori-sea:evidence:sawara-tone-channel","locator":"形状メモの『佐原の利根川出口』補正。PM指定点(140.50,35.90)、1200年幅300m、1600年幅700m。","note":"香取市Vol.208・Vol.148と国土交通省の利根川東遷資料にある銚子方面への流路を保つ。DEM下地で切れた区間を指定点から最大主水域まで接続した。回廊幅は表示用モデルで、歴史上の河幅測量値ではない。700年はDEM下地が検査点を含み銚子まで連結する。","publicationBasis":"original-reconstruction","sourceId":"katori-sea:source:chronomap-notes","supports":["geometry","location"],"usage":"derived-geometry"},{"id":"katori-sea:evidence:teganuma-inlet","locator":"形状メモの『手賀沼の入り江』補正。PM指定点(140.06,35.86)、DEM局所成分5m以下、全3年代。","note":"香取市Vol.208は中世頃の香取海が手賀沼を含むと説明する。指定点を含む局所DEM低地成分を抽出し、個別の接続水路は資料で特定できないため主水域との回廊を作らず保持した。各代表年へ適用することは長期的な水域範囲を用いたモデル推定であり、各年の正確な湖岸を示さない。","publicationBasis":"original-reconstruction","sourceId":"katori-sea:source:chronomap-notes","supports":["geometry","location"],"usage":"derived-geometry"}]
