[
  { "id": "kinugawa:evidence:overview", "sourceId": "kinugawa:source:mlit-overview", "locator": "鬼怒川の水源・流路・利根川への合流に関する河川概要", "usage": "citation", "supports": ["location", "identity"], "note": "鬼怒川の水系と現在の流域関係を確認する引用メタデータ。本文・図版は再現しない。" },
  { "id": "kinugawa:evidence:current-temporal", "sourceId": "kinugawa:source:mlit-overview", "locator": "現行河川概要を2020年比較時点として扱う記録", "usage": "citation", "supports": ["temporal", "identity"], "note": "現行の河川概要を本パイロットの2020年比較時点へ対応づける引用メタデータ。将来の現況更新を意味しない。" },
  { "id": "kinugawa:evidence:current-geometry", "sourceId": "kinugawa:source:shape-notes", "locator": "2020年LineString", "usage": "derived-geometry", "supports": ["geometry", "location"], "note": "公式河川概要の相対位置を少数の折れ点へ置いた概略線で、精密な河道中心線ではない。", "publicationBasis": "original-reconstruction" },
  { "id": "kinugawa:evidence:history", "sourceId": "kinugawa:source:history", "locator": "鬼怒川・小貝川の河道分離と江戸時代初期の治水史", "usage": "citation", "supports": ["temporal", "location", "identity"], "note": "鬼怒川・小貝川の分離と河道変遷に関する引用メタデータ。本文・図版は再現しない。" },
  { "id": "kinugawa:evidence:old-geometry", "sourceId": "kinugawa:source:shape-notes", "locator": "768年・1629年LineString", "usage": "derived-geometry", "supports": ["geometry", "location"], "note": "資料が示す接続関係を少数の折れ点で表した概略線。旧河道の精密な位置・幅・全区間を復元しない。", "publicationBasis": "original-reconstruction" },
  { "id": "kinugawa:evidence:change-map", "sourceId": "kinugawa:source:river-change", "locator": "旧版地形図と米軍写真による河道変遷の説明", "usage": "citation", "supports": ["temporal", "location", "identity"], "note": "旧版地形図と米軍写真で河道変遷を把握できることを確認する引用メタデータ。図版は再現しない。" },
  { "id": "kinugawa:evidence:separation-geometry", "sourceId": "kinugawa:source:shape-notes", "locator": "1629年Point", "usage": "derived-geometry", "supports": ["geometry", "location"], "note": "分離事業の比較用代表点で、工事区間・施設・旧河道の正確な位置ではない。", "publicationBasis": "original-reconstruction" }
]
