[{"id":"tonegawa:evidence:river-1590-citation","sourceId":"tonegawa:source:mlit-river-guide","locator":"利根川東遷の解説","usage":"citation","supports":["temporal","location","identity"],"note":"東遷事業の対象となる利根川と1590年の開始時期を確認する引用メタデータ。本文・図版は再現しない。"},{"id":"tonegawa:evidence:river-1590-geometry","sourceId":"tonegawa:source:shape-notes","locator":"1590年LineString","usage":"derived-geometry","supports":["geometry","location"],"note":"資料の相対関係を少数の折れ点にした概略線であり、精密な河道中心線ではない。","publicationBasis":"original-reconstruction"},{"id":"tonegawa:evidence:closure-citation","sourceId":"tonegawa:source:saitama-cultural-pdf","locator":"会の川締切に関する文化財解説","usage":"citation","supports":["temporal","location","identity"],"note":"会の川締切と1594年の関係を確認する引用メタデータ。本文・図版は再現しない。"},{"id":"tonegawa:evidence:closure-geometry","sourceId":"tonegawa:source:shape-notes","locator":"1594年Point","usage":"derived-geometry","supports":["geometry","location"],"note":"現在地図上の代表位置を小数第3位に丸めた点であり、施設の精密位置ではない。","publicationBasis":"original-reconstruction"},{"id":"tonegawa:evidence:river-1654-citation","sourceId":"tonegawa:source:mlit-plan-pdf","locator":"利根川東遷に関する概要図・解説","usage":"citation","supports":["temporal","location","identity"],"note":"1654年までの東遷後の利根川水系の説明を確認する引用メタデータ。PDF本文・図版は再現しない。"},{"id":"tonegawa:evidence:river-1654-geometry","sourceId":"tonegawa:source:shape-notes","locator":"1654年LineString","usage":"derived-geometry","supports":["geometry","location"],"note":"資料の相対関係を少数の折れ点にした概略線であり、精密な河道中心線ではない。","publicationBasis":"original-reconstruction"}]
